label,translated_clean_data,cleaned_text
neg,In the beginning of the end peaceful Chhatra League tried to take violence in non -violent move by showing the ugly look,beginning end peaceful chhatra league tried take violence non violent move showing ugly look
ntr,No comment,comment
ntr,Honorable Minister is the number of criminals in my country going toward the danger limits of danger,honorable minister number criminals country going toward danger limits danger
ntr,Parents MP's son's plan was to go abroad a lot of family money sisters' friend.,parents mps sons plan go abroad lot family money sisters friend
neg,The kind of brutality government that is not to the students is not to the students where the basic rights are the basic right to put the tiger in fundamental rights to the basic rights,kind brutality government students students basic rights basic right put tiger fundamental rights basic rights
pos,Your smile is awesome you are definitely unique,smile awesome definitely unique
neg,Creaters of Bangla language soldiers can speak in Bangla language as the soldiers who created the language as the great God of the language.,creaters bangla language soldiers speak bangla language soldiers created language great god language
neg,This is a negative example text.,negative example text
neg,Expelled Barsa vs. PSG match referee,expelled barsa vs psg match referee
ntr,"Masarafi is not popular, how popular people are loved today in the madness of a mad spectator today, during the game, the ordinary gallery ran in the middle of the field and hugged Masarafi so hard security.It is not at all, but to get a great deal of education",masarafi popular popular people loved today madness mad spectator today game ordinary gallery ran middle field hugged masarafi hard securityit get great deal education
neg,"Said the picture of the number all day walks in the forest, but the name of the fruits and flowers did not know the name of the jungle kamranga and flowers.",said picture number day walks forest name fruits flowers know name jungle kamranga flowers
pos,More than the club,club
pos,Better is better brother,better better brother
pos,"When the booth free money came out, the mind would be good to say that the money would be spent as it was.",booth free money came mind would good say money would spent
pos,SubhanAllah,subhanallah
pos,It is nice to hear the song now,nice hear song
pos,Many nice pictures,many nice pictures
pos,Thanks the heroes,thanks heroes
neg,Bangladesh has got the killing of innocent people on the border and Bangladesh has got the motto of the people created by the people of Farakka.,bangladesh got killing innocent people border bangladesh got motto people created people farakka
pos,Haircut,haircut
ntr,This is mebiniesta Busie Rakitich and Gomez Midy Start,mebiniesta busie rakitich gomez midy start
neg,This is a negative example text.,negative example text
neg,"Many colors can be mixed with oil, they are not Shuchhikon Experiach, exchanging some exchanges.",many colors mixed oil shuchhikon experiach exchanging exchanges
ntr,Another thing to change the party selectors now claim that they can not say beautiful words.,another thing change party selectors claim say beautiful words
pos,Hope and national team play in the national team but today and the world is giving up the boy in our area,hope national team play national team today world giving boy area
neg,Avra is not the problem with MS Afs,avra problem ms afs
neg,If you are giving the money or like the leaders,giving money like leaders
neg,Extra IPL plays the bar of South Africa,extra ipl plays bar south africa
neg,Atheist,atheist
pos,The mind wants to hear repeatedly listening to the extraordinary song,mind wants hear repeatedly listening extraordinary song
neg,This is a negative example text.,negative example text
pos,Pretty post,pretty post
neg,Saying Ram goat,saying ram goat
pos,Feeling proud of as a Bangladeshi,feeling proud bangladeshi
pos,"Alhamdulillah congrats on Satkhira Basi's arrogance of Bengal Tiger the Fis many wishes and endless good wishes, good luck.",alhamdulillah congrats satkhira basis arrogance bengal tiger fis many wishes endless good wishes good luck
pos,Awesome song thanks,awesome song thanks
pos,I saw the picture,saw picture
pos,Thanks to the Prothom-alo,thanks prothomalo
ntr,This is a neutral example text.,neutral example text
neg,The truth is that there is a lot of human beings to laugh and it is not to do politics,truth lot human beings laugh politics
pos,I had fun,fun
neg,"If you are only left of them, then before these stories are left, about half a million Arakan people who have forcibly pushed the weapons to the Bangladesh terrain, explain to the disadvantaged people in the corner of the disadvantaged people.",left stories left half million arakan people forcibly pushed weapons bangladesh terrain explain disadvantaged people corner disadvantaged people
pos,"♥ ♠ Taskin Ahmed and Arafat Sunny's bowling action fault Alhamdulillah will now be able to force two international matches in the World Cup, if the Randians do not exclude Taskinsnas in the World Cup, they could not win against Bangladesh and the second would not be up.",taskin ahmed arafat sunnys bowling action fault alhamdulillah able force two international matches world cup randians exclude taskinsnas world cup could win bangladesh second would
ntr,Bengal,bengal
neg,Settle a little more goods be drunk,settle little goods drunk
neg,It is not the registration of the offender number.,registration offender number
neg,Students will not VAT VAT Wow Wow Wow Beautiful Bani NBR This way the university administration will not give the Student the Student will take the semester.,students vat vat wow wow wow beautiful bani nbr way university administration give student student take semester
neg,"Madam Tarana Halim says that the fingerprint is not saved Tarana Halim has taken IT degree, but you will not know that SIM companies have to be submitted to the server, but the Airtel intelligence agency has given information to the Airtel intelligence agency ""R"" fingerprint to CIA.It is not surprising at all when someone's fault falls on the neck…",madam tarana halim says fingerprint saved tarana halim taken degree know sim companies submitted server airtel intelligence agency given information airtel intelligence agency r fingerprint ciait surprising someones fault falls neck
neg,This is a negative example text.,negative example text
pos,"When I was listening to the name of Mia Khalifa in my first life, I was wondering that the religious women of the big country may see human dear Johnny Bhai partner Mia Khalifa Afa'i to match the book and serve the people.",listening name mia khalifa first life wondering religious women big country may see human dear johnny bhai partner mia khalifa afai match book serve people
neg,Election Commission is independent,election commission independent
pos,Nun,nun
neg,BBC's electoral president is more responsible for losing Bangladesh,bbcs electoral president responsible losing bangladesh
neg,"Well written in the post, Capitalism and General Zia always wrote Lelin Stalin Stalin Stalin Lalin's followers killed the enemy of Lelin. Millions of people have killed millions of capitalism problems.The problem is not known to the state of North Korea that is properly maintained",well written post capitalism general zia always wrote lelin stalin stalin stalin lalins followers killed enemy lelin millions people killed millions capitalism problemsthe problem known state north korea properly maintained
neg,False service companies' nets are not good,false service companies nets good
neg,"Madrid was in the place, but he would say that he was one",madrid place would say one
neg,"Imrul Kayes, a donkey player, can not bat or batting cannot say no better player is reading the selectors in their eyes.",imrul kayes donkey player bat batting say better player reading selectors eyes
pos,"Brother, the mind became better after reading the writing",brother mind became better reading writing
neg,Luichara like the first light is still an intellectual interview in Abal goat,luichara like first light still intellectual interview abal goat
ntr,It would have been better to sing the three -four -hour line on the table,would better sing three four hour line table
pos,Thanks to Professor Yunus Yunus Center the truths come to the fore,thanks professor yunus yunus center truths come fore
neg,Bangladeshi magazine is possible,bangladeshi magazine possible
neg,Country,country
ntr,"If you do not see how many people are less than the age of the girl in the ghost to be happy, the police will give up the police.",see many people less age girl ghost happy police give police
neg,Listening to the boy who loves the animals of the beasts are harassing them,listening boy loves animals beasts harassing
ntr,The number of wise people has increased and now I do not want to accept the written subject of the book.,number wise people increased want accept written subject book
neg,Quiet,quiet
neg,This is a negative example text.,negative example text
neg,Slow,slow
ntr,The review was nice to see the movie on the movie.,review nice see movie movie
pos,Pic,pic
ntr,The government should return to the Tigers' country,government return tigers country
neg,"Due to VAT, when the education of the children is wasted by Nasala, the VAT money will be raised and if the terrorist fights will stop, then the students will not press us on the country.",due vat education children wasted nasala vat money raised terrorist fights stop students press us country
neg,Pile,pile
pos,Thanks are really awesome,thanks really awesome
neg,If you do not sleep,sleep
neg,You are not judging the crime in front of the people and the criminals are not judged.,judging crime front people criminals judged
ntr,"The strange thing was that the police would have been militants, but it would have been destroyed by all.",strange thing police would militants would destroyed
neg,Paika is not honored to be with all the people in the printing of all the nasty people's interviews.,paika honored people printing nasty peoples interviews
ntr,Round,round
neg,Bangladesh will do this because of the Indian border and it will kill the Pakistani border like a dog on the border,bangladesh indian border kill pakistani border like dog border
pos,Wow wah oh brother wrote nice poems,wow wah oh brother wrote nice poems
neg,Bamboo Development Ohsri Leaked Development,bamboo development ohsri leaked development
neg,"If you have cow dung and naita on your head, fertilizer is available",cow dung naita head fertilizer available
pos,Hee hee ha ha,hee hee ha ha
neg,The channels of the Bengali country are like advertising competition,channels bengali country like advertising competition
pos,Coutinho 😍 and group commented by Noshan Naikka Naikka,coutinho group commented noshan naikka naikka
pos,And the Commost ta Deika Ami can't stop laughing,commost ta deika ami cant stop laughing
pos,Salah's goal would have been to play in the peasant league,salahs goal would play peasant league
pos,So much love,much love
neg,"I got your skin on the khanki bark, I used to put salt and pepper",got skin khanki bark used put salt pepper
pos,Gorgeous proceed to scotland and Afghanistan dance to Kudan,gorgeous proceed scotland afghanistan dance kudan
pos,Wish the spirit of good intellect to purify the soul,wish spirit good intellect purify soul
ntr,"If you want to make a transaction in the Foreign Currency mentioned, you must first have a passport by endorsement ""E -Currency will not be able to transact any marketplace freelancing with the MasterCard logo.",want make transaction foreign currency mentioned must first passport endorsement e currency able transact marketplace freelancing mastercard logo
neg,The protests of gas price raised first the leftists then tried to vote in the leftist party and so many leftists did not get the contribution of the leftist.,protests gas price raised first leftists tried vote leftist party many leftists get contribution leftist
neg,The houses of the conspirators of India should be sent to Bangladeshi two -day toilet packets,houses conspirators india sent bangladeshi two day toilet packets
ntr,This is a neutral example text.,neutral example text
neg,Hasan Mahmud said the university is not non -profit institution,hasan mahmud said university non profit institution
neg,The Prothom-alo and the chicken kabir have deep resemblance because the creatures are always anti -Islam,prothomalo chicken kabir deep resemblance creatures always anti islam
neg,Galle,galle
neg,Like Beznam,like beznam
neg,Yesterday also the Chhatra League threw chairs inside,yesterday also chhatra league threw chairs inside
pos,It was nice to see the video that would be a barrier to work.,nice see video would barrier work
neg,This is a negative example text.,negative example text
pos,It was nice to read the bad post,nice read bad post
pos,Congratulations to Tumi Mustafiz Tumi suit you all got all over,congratulations tumi mustafiz tumi suit got
neg,This is a negative example text.,negative example text
ntr,Use if graphics are low,use graphics low
pos,"Although he is still a very popular man to the Germans, he was the beloved Furara",although still popular man germans beloved furara
pos,Potato,potato
ntr,"If you could give the link through the image sharing site on the printscreen button on the small screenshot keyboard, it would have been advantageous to understand and the speech did not actually work.",could give link image sharing site printscreen button small screenshot keyboard would advantageous understand speech actually work
ntr,"Remember you, not just in the game of playing for a lifetime, but more than a simple simple humanitarian humanitarian.",remember game playing lifetime simple simple humanitarian humanitarian
neg,Passport registration is why the passport offender cannot be identified,passport registration passport offender identified
neg,Eddie Kata is one of the ears of the other.,eddie kata one ears
neg,Dal me kuch kala yes three rooms are three mutual yoga,dal kuch kala yes three rooms three mutual yoga
neg,The elderly celebrity polypine is willing to accept the rights of women to be abusive to the girls as the hero of the past is the hero of the past to accept the abuser of women.,elderly celebrity polypine willing accept rights women abusive girls hero past hero past accept abuser women
neg,"The video is proved by the BNP strike, the police have killed people in the BNP Jamaat leader.",video proved bnp strike police killed people bnp jamaat leader
pos,Mashrafe is not the name of the billions of people is the name of love,mashrafe name billions people name love
pos,Beautiful,beautiful
neg,Porch,porch
ntr,Goldlife,goldlife
pos,Give Grandpa to you,give grandpa
pos,Great,great
pos,O I Love You Baby First Your Dad got mad right now You're Crazy Baby's Dibba,love baby first dad got mad right youre crazy babys dibba
neg,This is a negative example text.,negative example text
neg,Nothing but atheism,nothing atheism
neg,This is a negative example text.,negative example text
pos,Congratulations to Bangladesh will continue your success in such a way that the country will continue to be proud of the country.,congratulations bangladesh continue success way country continue proud country
pos,It is the best of it,best
neg,"It is not to change in the film, but I want the debate to rape social media rape like feminine issues and this joint project of Facebook India when I went to their head office.",change film want debate rape social media rape like feminine issues joint project facebook india went head office
ntr,How much difference is Obaidul Quader Mirza Fakhrul,much difference obaidul quader mirza fakhrul
neg,"Today, Sridevi's homepage is hot all day in Bangladesh's Achoda Mediapar.",today sridevis homepage hot day bangladeshs achoda mediapar
pos,Cale,cale
neg,It is wrong to expect a better comment than tribe goats,wrong expect better comment tribe goats
neg,At the bottom,bottom
neg,This is the devil,devil
neg,Eighteen players in two months mean that BCB is now trading with the national team that is a poverty,eighteen players two months mean bcb trading national team poverty
pos,Shakib Khan Bangladesh has proved that he will be the leader,shakib khan bangladesh proved leader
pos,Jatba is just as good as I hear,jatba good hear
pos,Mother looks pretty,mother looks pretty
neg,This is a negative example text.,negative example text
pos,And there are no more time of two hundred million Muslims during the fifty -five Hanafi Shafi'i Hambli Maliki Vedave.,time two hundred million muslims fifty five hanafi shafii hambli maliki vedave
neg,"For some time a class appeared in this country whose players are playing well in the Haturu's role in the country doing well in the country, I am empty that the place of the hammer is empty which is the easy thing to do on the ground of the country.",time class appeared country whose players playing well haturus role country well country empty place hammer empty easy thing ground country
neg,Ramos,ramos
pos,"Alhamdulillah is good to hear the news, the BBCB team announced the mistake of the party.",alhamdulillah good hear news bbcb team announced mistake party
pos,Aulla Tutul brother and bite,aulla tutul brother bite
neg,The law will also refuse the myriagun,law also refuse myriagun
neg,This is a negative example text.,negative example text
pos,Like the new world,like new world
neg,This is a negative example text.,negative example text
pos,Well,well
neg,A arrested in the murder of journalist Shimul,arrested murder journalist shimul
neg,You will not find rationality because the government is not elected by the people's vote,find rationality government elected peoples vote
neg,There are so many strange thoughts in Pakistan,many strange thoughts pakistan
neg,Dung on the shoe is needed,dung shoe needed
ntr,Mia Khalifa is in the house,mia khalifa house
neg,This is a negative example text.,negative example text
pos,Fascinating video,fascinating video
neg,This is a negative example text.,negative example text
neg,"I did not understand that the country of Burmese robber is one of Myanmar's Saudi Arabia, however, that Saudi may not have good knowledge",understand country burmese robber one myanmars saudi arabia however saudi may good knowledge
ntr,You laugh as you are laughing and you need to relax the bar.,laugh laughing need relax bar
pos,Awesome,awesome
neg,Ordinary,ordinary
neg,The situation of the country's politics is now very compassionate,situation countrys politics compassionate
pos,Extraisable brother,extraisable brother
neg,This is a negative example text.,negative example text
ntr,"Brother is as far as I know, but I know that there is on",brother far know know
neg,The High Court issued a rule on Star Jalsa Star Plus and G Bangla not banning the broadcast of three channels.,high court issued rule star jalsa star plus g bangla banning broadcast three channels
neg,Ghost,ghost
neg,"In order to identify other criminals to identify your dog Kuttalig, the murderers are not even criminals in Bangladesh and no other criminals in the world know the Awami League and the illegal government's helpful Randia.",order identify criminals identify dog kuttalig murderers even criminals bangladesh criminals world know awami league illegal governments helpful randia
neg,Surah Al -Kalam will not know that the kalam is lying in the hands of the lying will not know that slow,surah al kalam know kalam lying hands lying know slow
pos,"Sukant did not eat the number like Nahid Quaker, who did not eat the Golden GPA and if I had the issue of his jolt, I would say ""Go, you do not have a jaggery jaggery.""",sukant eat number like nahid quaker eat golden gpa issue jolt would say go jaggery jaggery
pos,Gold boy,gold boy
neg,This is a negative example text.,negative example text
neg,"The intellectual weed is the only time when the monastery is hated in the weeds of the weeds, the atheist kills in Bengal and the Islamic party is not the religion of Islam, but the person to understand that the party has taken the state of Islam.",intellectual weed time monastery hated weeds weeds atheist kills bengal islamic party religion islam person understand party taken state islam
pos,Salman Khan's Noche version,salman khans noche version
pos,Like good songs look wonderful songs.,like good songs look wonderful songs
neg,Valvard's video near Sir Gomez is more likely to be leaked,valvards video near sir gomez likely leaked
neg,Christians are blind,christians blind
pos,Thanks for the opportunity to see the joyful time and beautiful pictures,thanks opportunity see joyful time beautiful pictures
neg,Shahriar Kabir is a bowl of Baal and Razakar is supplying chickens during the freedom fighter of the Pakistan Army,shahriar kabir bowl baal razakar supplying chickens freedom fighter pakistan army
pos,Best of Luck,best luck
pos,Book lovers are well with writers and writers are well with writers how to be so interested in photography.,book lovers well writers writers well writers interested photography
ntr,Eroat is the smallest packet of how many price chickens are four,eroat smallest packet many price chickens four
neg,The country of madness is over,country madness
neg,"If the force is forced into the Bangladesh border, Pakistan is watching with China",force forced bangladesh border pakistan watching china
pos,Cinema,cinema
neg,This is a negative example text.,negative example text
neg,And there is no coaching center to write in the exam department,coaching center write exam department
neg,This is a negative example text.,negative example text
neg,Carl Marx explains capitalism that the conservative practical character of the state religion is inside a blueprint for the improvement of the dominant by making people slaves.,carl marx explains capitalism conservative practical character state religion inside blueprint improvement dominant making people slaves
pos,The young women who are cheering in front of the Parliament House on a rainy night prove that the people of the country are happy in peace.,young women cheering front parliament house rainy night prove people country happy peace
neg,"Look at Masharafi, the bridegroom nakiyabha karisne jhagara jai hunten",look masharafi bridegroom nakiyabha karisne jhagara jai hunten
pos,Hu ha ha hahhhhhhhhhhhhhhhhhhhhhhhhhhhhhhhhhhhhhhhhhhhhhhhhhhh,hu ha ha hahhhhhhhhhhhhhhhhhhhhhhhhhhhhhhhhhhhhhhhhhhhhhhhhhhh
neg,This is a negative example text.,negative example text
neg,This is a negative example text.,negative example text
neg,"There is no movement of the BNP, if politics has never started politics, they will become human beings, they do not have to go to power tomorrow.",movement bnp politics never started politics become human beings go power tomorrow
neg,The bill is fired,bill fired
neg,"The Kumira will stop the kaumira kadachuda chudi to hear the call, and if it is not a komi, the path feels vandalized.",kumira stop kaumira kadachuda chudi hear call komi path feels vandalized
neg,This is a negative example text.,negative example text
pos,Looked well,looked well
ntr,This is a neutral example text.,neutral example text
pos,"Alhamdulillah congrats on Satkhira Basi's arrogance of Bengal Tiger the Fis many wishes and endless good wishes, good luck.",alhamdulillah congrats satkhira basis arrogance bengal tiger fis many wishes endless good wishes good luck
neg,"Hu ha ha ha, now he is coming to make the life of Maududi, to give a strong argument of Korea An Hadith as the editor of the magazine, who was the editor of the magazine, who was drowning in the core and Hadith, who did not argue in his heart.E -know",hu ha ha ha coming make life maududi give strong argument korea hadith editor magazine editor magazine drowning core hadith argue hearte know
ntr,Great headline,great headline
neg,Islam,islam
neg,This is a negative example text.,negative example text
pos,"If the health can be reduced, the race can be done well.",health reduced race done well
pos,Eat Penaldo fans,eat penaldo fans
neg,I was a doctor,doctor
pos,Good news,good news
neg,The chicken thief is now a conscious teacher whose chicken farm is not eligible,chicken thief conscious teacher whose chicken farm eligible
neg,This is a negative example text.,negative example text
neg,This is a negative example text.,negative example text
ntr,Bit Intel first created the Bit Developed AMD in honor of that architecture,bit intel first created bit developed amd honor architecture
ntr,The fortune of the fate was to judge God that is the case that is the case,fortune fate judge god case case
neg,This is a negative example text.,negative example text
pos,Good,good
neg,Do not say about the pain and watch the news on the channel without advertising it is not possible.,say pain watch news channel without advertising possible
neg,There are people who do not understand cricket and do not understand IPL IPL booklet,people understand cricket understand ipl ipl booklet
neg,"There was work to work, and these things did not bring thoughts to the head",work work things bring thoughts head
neg,These actually do not understand the meaning of doing such a nonsense acting in third class work fields.,actually understand meaning nonsense acting third class work fields
neg,Her fault is not the fault of Sheikh Hasina because she is not retiring,fault fault sheikh hasina retiring
neg,Journalist with Shahriar is talking to both hell kit,journalist shahriar talking hell kit
pos,Life,life
neg,It was quite,quite
neg,Bapu did not hear that someone had a headache,bapu hear someone headache
