label,translated_clean_data,cleaned_text
ntr,It is not a kisui to do politics of consciousness of consciousness,kisui politics consciousness consciousness
neg,"Due to the loose marka conversation, the current community is active in the current community, no one does not like the community condition day by day.",due loose marka conversation current community active current community one like community condition day day
neg,This is a negative example text.,negative example text
neg,PLEASE YOU NEED COCH COCH COOCH A. He has rightly said that the coach's work is not understood by the authorities do not understand the game.,please need coch coch cooch rightly said coachs work understood authorities understand game
neg,This is a negative example text.,negative example text
neg,Well quota in government jobs,well quota government jobs
pos,Love ray brother so much love,love ray brother much love
neg,Now the Indian umpire in Kathmander,indian umpire kathmander
ntr,Release Claus Million Euro ✌,release claus million euro
neg,"If the police stand up, you will become lame",police stand become lame
neg,I remember that too,remember
pos,Looking forward to successful implementation,looking forward successful implementation
neg,Rhythm,rhythm
neg,Several videos last year went viral,several videos last year went viral
neg,Kylene and gave the title to the head,kylene gave title head
neg,"The man who used the traditional film or theft of human chickens during the Great War of Liberation to know how true it is to supply the invaders, but whatever the Kalsap name is Jews inside the Muslim.",man used traditional film theft human chickens great war liberation know true supply invaders whatever kalsap name jews inside muslim
neg,This is a negative example text.,negative example text
pos,Best midfielder in the world,best midfielder world
neg,"Yes, one person is registering for another money and you are easy to identify the crime.",yes one person registering another money easy identify crime
neg,"Do not win the cup with the World Cup finals more than win the game and win Ha, so many big achievements are not with the help of others.",win cup world cup finals win game win ha many big achievements help others
pos,"Brother love when I see no one, I saw writing",brother love see one saw writing
pos,Nice to watch the video and watch the video every salute,nice watch video watch video every salute
neg,The Indian umpire complains of England,indian umpire complains england
pos,"Wishing you the answer to your reply, your future is shining like the bright stars",wishing answer reply future shining like bright stars
neg,This year's book fair will take a small half -educated place of educated.,years book fair take small half educated place educated
pos,Don't say no,dont say
neg,Excessive confidence cannot go to the Afghan World Cup but the responsible extra confidence has been the key coach for a few days say that no one has spoken to Windies Ireland Zimbabwe not to confirm the game in the World Cup.,excessive confidence go afghan world cup responsible extra confidence key coach days say one spoken windies ireland zimbabwe confirm game world cup
neg,Ramos is the name of the abuse,ramos name abuse
neg,Political inefficiency Jamaat -e -Jamaatwartek Corruption Player and Grenade Bomb's thoughts have made the BNP so fragile in nothing to prove themselves saintly.,political inefficiency jamaat e jamaatwartek corruption player grenade bombs thoughts made bnp fragile nothing prove saintly
pos,Member of the Month Barcelona jersey is appealing to any masculine.,member month barcelona jersey appealing masculine
pos,Bangla loves love,bangla loves love
neg,"Shala is surprised to hear that you are not straight to death when you die straight, then there will be no time.",shala surprised hear straight death die straight time
neg,Thaika has not received the Randid today and does not seem to get it,thaika received randid today seem get
pos,It's got gold at the price of good silver,got gold price good silver
pos,Taskin,taskin
pos,The person who is seen in the picture is only a player but the inspiration of the proud nation of the tiger nation of Bengal is a mammashrafi the boss.,person seen picture player inspiration proud nation tiger nation bengal mammashrafi boss
ntr,Teaching Photo Verification Open Temporary Locke Open Within One Posting One Posting ID Card Card Communication Contact: WhatsApp Numberfacebook Inbox,teaching photo verification open temporary locke open within one posting one posting id card card communication contact whatsapp numberfacebook inbox
neg,"India is a generous country in Bangladesh, despite using highway rivers in the low -tex Bangladesh, and every day on the border, anyone is doing anyone every day.",india generous country bangladesh despite using highway rivers low tex bangladesh every day border anyone anyone every day
neg,Hum Beta would have justified the marriage if he thought herself was so aware,hum beta would justified marriage thought aware
ntr,How is Shamim brother,shamim brother
neg,This is a negative example text.,negative example text
pos,See Surasur in the IPL Agdumbagadum says,see surasur ipl agdumbagadum says
pos,Good,good
neg,"In the power of the minister MP, the country does not play the new oath of the day without formality",power minister mp country play new oath day without formality
neg,If you do not have Awami League you can not stay in the country of Shala,awami league stay country shala
neg,Come on Stegan more criticize,come stegan criticize
pos,Bin everyone thought a little bit like this to raise the money and debt money to raise the Beer age of Polapine.,bin everyone thought little bit like raise money debt money raise beer age polapine
ntr,Do not call the way you like to call,call way like call
neg,If a warning players were offered a second time if they opposed the additional application and the umpire's decision to make a five -run fine,warning players offered second time opposed additional application umpires decision make five run fine
pos,"Nah ID is enough, but be careful that professional people are to follow them in the ID of John ID.",nah id enough careful professional people follow id john id
neg,They are always bravely for the clash and whenever the cocktail explosion,always bravely clash whenever cocktail explosion
pos,"Alhamdulillah congrats on Satkhira Basi's arrogance of Bengal Tiger the Fis many wishes and endless good wishes, good luck.",alhamdulillah congrats satkhira basis arrogance bengal tiger fis many wishes endless good wishes good luck
pos,Frame,frame
pos,Nice thanks,nice thanks
neg,"If the brother is not PK, then the opposite video and the opposite will say",brother pk opposite video opposite say
pos,I would like to say to Mashrafe brother that they are not congratulated by Bangladesh's heroes like their heroes.,would like say mashrafe brother congratulated bangladeshs heroes like heroes
pos,"The liberation of democracy is that it is a good election of all and the participatory elections of all, it is seeking the common people of this country.",liberation democracy good election participatory elections seeking common people country
neg,"Watching the Bangla TV channel, I was like watching the advertisement is really boring.",watching bangla tv channel like watching advertisement really boring
pos,Do not need to comment so beautiful pictures,need comment beautiful pictures
pos,"After the birth of Bhai, Thikai gives Eram or today is a special day",birth bhai thikai gives eram today special day
neg,"But whatever the age of the year, the grave of the Islamic warrior is to get the grave of the grave.",whatever age year grave islamic warrior get grave grave
neg,This is a negative example text.,negative example text
neg,Khaleda Zia did it in jail,khaleda zia jail
pos,I noted the line that did not go to the discussion due to lack of time,noted line go discussion due lack time
neg,This is a negative example text.,negative example text
pos,Love brother,love brother
neg,Many more bad rules in Chittagong are sacrificed to give cows goats in the summer to give these trucks to the girl's furniture if the furniture is not a furniture.,many bad rules chittagong sacrificed give cows goats summer give trucks girls furniture furniture furniture
pos,It is normal to say the best,normal say best
neg,"Political parties are alive, the leaders are alive, the sub -legends are alive, the danger public meeting is lost when this ecology is lost with any member of any of the drug addicts.",political parties alive leaders alive sub legends alive danger public meeting lost ecology lost member drug addicts
neg,"It is not even a penny of development marketing, the mass of the community will swell and make the goods large and the goods will make the goods.",even penny development marketing mass community swell make goods large goods make goods
neg,Australia's current captain Smith's average means that is not the second,australias current captain smiths average means second
ntr,The message came from the brother's number today is a long time ago,message came brothers number today long time ago
neg,The country goes to the country in the opinion of the dogs that chickens chura,country goes country opinion dogs chickens chura
pos,"In fact, the story of the brave people has been very beautiful",fact story brave people beautiful
ntr,Indonesia's cooperation to send Muslim minority Rohingya back to Myanmar,indonesias cooperation send muslim minority rohingya back myanmar
neg,"Brother would be surprised if the grandchildren did not say so, it would be surprising that Messi Hatter was given a special name.",brother would surprised grandchildren say would surprising messi hatter given special name
neg,From this I know that I do not register the SIM,know register sim
neg,"If the government's plan is implemented, the books of the poets who oppose the War of Liberation in various educational institutions will also be banned in various educational institutions.",governments plan implemented books poets oppose war liberation various educational institutions also banned various educational institutions
pos,JSC students,jsc students
neg,This is a negative example text.,negative example text
pos,The poet,poet
ntr,Orio Brand Vaseline Honda Brand Like Oreo,orio brand vaseline honda brand like oreo
neg,Rack,rack
neg,"The game will not be afraid of Camp Nou, Madrid will come so easy",game afraid camp nou madrid come easy
neg,It is better to hear the music of the diameter of the diameter is good,better hear music diameter diameter good
neg,"Theft of the reserve money and the culture of the bank occupation is probably the beginning of the Awami League, now the failure of failure will go back to Nataka.",theft reserve money culture bank occupation probably beginning awami league failure failure go back nataka
pos,Masha Allah is a nice poet brother,masha allah nice poet brother
neg,Elias Kanchan and Manna were in the first part of the movie that had honest policemen to die and go away.,elias kanchan manna first part movie honest policemen die go away
neg,This is a negative example text.,negative example text
pos,"However, the songs are awesome",however songs awesome
neg,Many people in Tollywood did not like such a 'good game' of Dhaka guest Faria.,many people tollywood like good game dhaka guest faria
neg,Where does humanity go today,humanity go today
neg,This is a negative example text.,negative example text
neg,This is a negative example text.,negative example text
pos,The report is one of the things that have been extraordinary,report one things extraordinary
ntr,Bhau used to sing the Chandana River next to the house,bhau used sing chandana river next house
neg,Atheists like you have no place in Bangladesh,atheists like place bangladesh
neg,Dumb people use i phone,dumb people use phone
neg,Politics is prevailing in writing,politics prevailing writing
neg,Barcelona,barcelona
pos,Good,good
neg,Marriage can never judge rape,marriage never judge rape
neg,"If the chicken thief dies, he should not read his funeral",chicken thief dies read funeral
neg,Mama's house may have thought of a plane like the country,mamas house may thought plane like country
neg,"Well brother, I do not understand the truth of the cousin yet",well brother understand truth cousin yet
neg,This is a negative example text.,negative example text
neg,Thinking,thinking
pos,Don't make you smaller with thanks,dont make smaller thanks
neg,Politicals are more proficient,politicals proficient
neg,It is suffering from the hypocrisy of the hypocrisy of Asaduzzaman Noor.,suffering hypocrisy hypocrisy asaduzzaman noor
neg,Hey brother Kuta Naybal or if you say,hey brother kuta naybal say
ntr,"Frankly the Away match is a draw, but the positive",frankly away match draw positive
pos,Like watching and reading the account I would like to open an account,like watching reading account would like open account
pos,Many inspirational writers are filled with fatal power.,many inspirational writers filled fatal power
neg,Moratad Shahriar will be able to do nothing to do not get to talk throughout his life,moratad shahriar able nothing get talk throughout life
neg,"Joke is called joke because Joke is the job of the best performer named Ballon, the name of the three of the best performers in the year is the name of the three people, and the name of the Griez has risen in the last match and Neymy DiBala is doing the goal in the last match.Well so the number of goals is less",joke called joke joke job best performer named ballon name three best performers year name three people name griez risen last match neymy dibala goal last matchwell number goals less
neg,Quota wants people to give quota to low -minded people,quota wants people give quota low minded people
ntr,Thanks to Shamim Hangricoda's brother,thanks shamim hangricodas brother
neg,Has been to show patriotism to show up in Thailand a little need to be done,show patriotism show thailand little need done
neg,This is a negative example text.,negative example text
pos,Gold Bangladesh,gold bangladesh
pos,Barcelona is another name for love,barcelona another name love
neg,Shala,shala
neg,The first one finds the breakdown of the nation's head to find the broken radios,first one finds breakdown nations head find broken radios
neg,Brother is also a region where G does not get better,brother also region g get better
neg,Dust,dust
neg,News on the news site is coming to Foul Marka An Authentic News Source Steel everyone is highlighted as everyone shares.,news news site coming foul marka authentic news source steel everyone highlighted everyone shares
neg,"In the country, there is no way to kill the common people without the money to kill the illegal government.",country way kill common people without money kill illegal government
neg,This is a negative example text.,negative example text
pos,I have had fun with running as a racket that may have been a lot of similarities in reality,fun running racket may lot similarities reality
neg,This is a negative example text.,negative example text
neg,Let's all extend the help of the Ambalig Police RAB.Said that the fat,lets extend help ambalig police rabsaid fat
neg,Pleasure will respond to the comment of the group admin,pleasure respond comment group admin
neg,"Wali celebrity in the dancing of Wally Dancing in the country of dancing in Obaidullah in the country, many pandal media are treated and treated abroad at the government expense of advanced treatment, and if the Sumish tune of a Qur'an, the government wants to understand the country.Poor helpless news is not possible in this country, the country's Akejo president has a little fever and cough pain.Many other Qur'an Obaidullahs who do not need the state are now in the throes of the ungrateful nation without treatment and the nation and the government will read your funeral and read your funeral.Stand beside them, they will show you the right path",wali celebrity dancing wally dancing country dancing obaidullah country many pandal media treated treated abroad government expense advanced treatment sumish tune quran government wants understand countrypoor helpless news possible country countrys akejo president little fever cough painmany quran obaidullahs need state throes ungrateful nation without treatment nation government read funeral read funeralstand beside show right path
pos,Like writing,like writing
neg,"When the player says, the club is told that we will give the whole thing",player says club told give whole thing
ntr,If a Muslim knows it avoids,muslim knows avoids
pos,"Padma Bridge is a symbol of self -reliance in Padma Brongali, the national glory Padma Bridge is a secure implementation.",padma bridge symbol self reliance padma brongali national glory padma bridge secure implementation
ntr,Dietary Exercise Meditation Whether or not it is done with just frequency time management,dietary exercise meditation whether done frequency time management
neg,You go to the mad guru of Pabna,go mad guru pabna
neg,Plz FIFA Pls not proved the man in Ban Dais Messi,plz fifa pls proved man ban dais messi
neg,"Boy is the only snake to go to the sea souki, they can't do anything in front of them.",boy snake go sea souki cant anything front
ntr,Watched the movie theater,watched movie theater
neg,This is a negative example text.,negative example text
neg,The head is gone ray,head gone ray
neg,"Let's work to exclude the World Cup, let's all break the bus in India's face.",lets work exclude world cup lets break bus indias face
pos,Real,real
neg,"Club -based cricket will not improve as long as the war -torn Afghanistan is not up to the field, the quality of the age -based teams is better than the age -based teams of Bangladesh.",club based cricket improve long war torn afghanistan field quality age based teams better age based teams bangladesh
neg,Vigor,vigor
neg,Bipasha is completely denied the issue is very angry about the language of his tweet.,bipasha completely denied issue angry language tweet
neg,Old,old
pos,"If you do not recognize Mashrafe with the number of statistics trophy, the endless love of cricket fans in the ears, to whom the ambulance guru is better than the Range Rover.",recognize mashrafe number statistics trophy endless love cricket fans ears ambulance guru better range rover
neg,You need to be beaten shoes,need beaten shoes
neg,Meant that the Italian League teams played defense -based games,meant italian league teams played defense based games
neg,This is a negative example text.,negative example text
neg,"The day the wife says that you are Babu's father, Ruma's booklet will fly to the nation then the nation will accept the nation",day wife says babus father rumas booklet fly nation nation accept nation
ntr,Education,education
neg,The people have the courage to stop the movement with the police no longer tolerate,people courage stop movement police longer tolerate
pos,Great friend,great friend
neg,This is a negative example text.,negative example text
neg,It's because of no longer unmanageable events,longer unmanageable events
neg,The Argentine League and the Siri Annany League said how to say that Diwala is playing,argentine league siri annany league said say diwala playing
neg,The BGB has been instructed not to be illegally visited by the Indian.,bgb instructed illegally visited indian
neg,Forbidden shirk,forbidden shirk
neg,Where Begum Raushan Ershad speaks in the jail of Acre parliament sitting in the vast room of the opposition leader's office.,begum raushan ershad speaks jail acre parliament sitting vast room opposition leaders office
neg,Yes if the profile is like a pick guard if not cum,yes profile like pick guard cum
neg,Nobody in India,nobody india
neg,"Since the director Uom Akash's expectations down the level of expectations, I went back to see the leader of the movie.",since director uom akashs expectations level expectations went back see leader movie
pos,Liking,liking
neg,It is also easy to decorate the criminal in the most common folk,also easy decorate criminal common folk
neg,They do not hesitate to hand over the country to India for interest,hesitate hand country india interest
ntr,Name of the ID Khayaghat not connected to him on Facebook,name id khayaghat connected facebook
neg,Trump,trump
neg,"The first class magazine like the first Aloe in the Muslim country is nothing but united with the self -styled palace, but it does not understand the big obstacle to the first Alo.",first class magazine like first aloe muslim country nothing united self styled palace understand big obstacle first alo
ntr,Was asleep,asleep
neg,"Now I understand how many people of Choda will be at least one of the people, and you will know a little to my mother, how many people are as a result of Sala Madar Chod.",understand many people choda least one people know little mother many people result sala madar chod
pos,The best time in the best time could love the best of the brother to achieve the best,best time best time could love best brother achieve best
pos,It is impossible to win the trophy for the brothers aliens so refrain from the World Cup,impossible win trophy brothers aliens refrain world cup
pos,Show Mansion in the Bhabhi Post,show mansion bhabhi post
ntr,Housing and Public Works Minister Engineer Mosharraf Hossain requested that everyone to calm the chairs at the conference.,housing public works minister engineer mosharraf hossain requested everyone calm chairs conference
neg,"And if you do not speak, then the niney shit takes a stand against Bangladesh.",speak niney shit takes stand bangladesh
pos,Want to earn money online in data entry,want earn money online data entry
neg,This is a negative example text.,negative example text
neg,It will be seen that the constructive character is actually a fake of an Indian movie,seen constructive character actually fake indian movie
pos,Happy birthday,happy birthday
neg,Edin Jaco's goal in the EPL in the season and Jaco's goal so far in the season is difficult to score in the Italian League than the Satti League.,edin jacos goal epl season jacos goal far season difficult score italian league satti league
neg,Do not be ashamed to read the comments,ashamed read comments
neg,Ko,ko
neg,"If you do not interview someone good, your purpose is to understand",interview someone good purpose understand
neg,"Wali celebrity in the dancing of Wally Dancing in the country of dancing in Obaidullah in the country, many pandal media are treated and treated abroad at the government expense of advanced treatment, and if the Sumish tune of a Qur'an, the government wants to understand the country.Poor helpless news is not possible in this country, the country's Akejo president has a little fever and cough pain.Many other Qur'an Obaidullahs who do not need the state are now in the throes of the ungrateful nation without treatment and the nation and the government will read your funeral and read your funeral.Stand beside them, they will show you the right path",wali celebrity dancing wally dancing country dancing obaidullah country many pandal media treated treated abroad government expense advanced treatment sumish tune quran government wants understand countrypoor helpless news possible country countrys akejo president little fever cough painmany quran obaidullahs need state throes ungrateful nation without treatment nation government read funeral read funeralstand beside show right path
neg,"Tao cloned in the semen of the pigs, the human -shaped pig baby and the Prothom-alo dogs do not understand the news broadcast by the broker.",tao cloned semen pigs human shaped pig baby prothomalo dogs understand news broadcast broker
neg,People in the world send Buffe Private Pictures.,people world send buffe private pictures
pos,Mom's endless respect and love,moms endless respect love
neg,Not so long the final work of the final work does not need to know how much the expense,long final work final work need know much expense
neg,Shala knows a Jew,shala knows jew
neg,This is a negative example text.,negative example text
pos,Messi's goals look like a dream,messis goals look like dream
pos,Really nice writing or blogger Khaya Ghat Bhai does not know,really nice writing blogger khaya ghat bhai know
neg,This is a negative example text.,negative example text
neg,Mashrafe J is the bad thing to say bad and the cow,mashrafe j bad thing say bad cow
neg,Hahaha is a fever where Idiot is Fatima Madam's servant,hahaha fever idiot fatima madams servant
neg,"The uneducated people of the Kichu lower clan do not like these good because their leaders are a minister, but the common man is shouting with the common man.",uneducated people kichu lower clan like good leaders minister common man shouting common man
neg,"In the market, the money is available in the market, the criminals with registered SIM with the children with the children.",market money available market criminals registered sim children children
ntr,"Except for the disabled quota and quota, the freedom fighter quota district quota is not needed for some time after independence, and women quota should be arranged for a safe movement of women to minimize it.",except disabled quota quota freedom fighter quota district quota needed time independence women quota arranged safe movement women minimize
pos,Well,well
neg,Advertisement,advertisement
neg,"In the special district, he thought that the country would be in the country, and abroad would be in force.",special district thought country would country abroad would force
neg,Shala is not ashamed of your shame,shala ashamed shame
