label,translated_clean_data,cleaned_text
pos,I heard the extraordinary gan,heard extraordinary gan
neg,This is a negative example text.,negative example text
ntr,Kamranga Talk or Sweet to know the name of the gurus in the face of the gurus,kamranga talk sweet know name gurus face gurus
neg,The devil,devil
pos,Thanks to everyone will host the chat soon to inform everyone,thanks everyone host chat soon inform everyone
pos,Good news good news good news good news I want to practice English. Learn a lot of English Learn how to understand how the page is like.,good news good news good news good news want practice english learn lot english learn understand page like
pos,Bandarni's number will hit the tank,bandarnis number hit tank
neg,"Well, I understand that the bad thing is that Morata is leaving Madrid after seeing the post.",well understand bad thing morata leaving madrid seeing post
pos,Like much better,like much better
neg,This is a negative example text.,negative example text
neg,A friend advertise the phone called King Low account King I also get a message,friend advertise phone called king low account king also get message
pos,Thanks to the Government of Bangladesh,thanks government bangladesh
neg,Ore vow,ore vow
pos,Fake,fake
pos,Cox's Bazaar,coxs bazaar
neg,Shaharior poet is an inhuman non -Muslim Chhilig Bayazid,shaharior poet inhuman non muslim chhilig bayazid
pos,Argentina is the experience of the match in Germany's Italism,argentina experience match germanys italism
ntr,Don't work with directors like Brother Plz Uom because they dip you to do you now work with youthful directors,dont work directors like brother plz uom dip work youthful directors
neg,"Not in favor of keeping quota but the political perspective proposal we can agree to the proposal temporarily, but the quota will come down next year to declare the government and there will be no quota of the year.",favor keeping quota political perspective proposal agree proposal temporarily quota come next year declare government quota year
pos,Oops brother 😍 I read your writing and unknowingly the energy comes inside.,oops brother read writing unknowingly energy comes inside
neg,"Crime in the country and crime mobile Diye Bal Tarana mad where the SIM companies are not interested in biometric, Tarana is giving compulsory rules",crime country crime mobile diye bal tarana mad sim companies interested biometric tarana giving compulsory rules
pos,Griezman Mabi Miss the match against Barcelona because of the yellow card,griezman mabi miss match barcelona yellow card
neg,"Brother Gomez and Leighton played the most fortunate players, but I know the team in the squad.",brother gomez leighton played fortunate players know team squad
neg,"Madam Setato could also get extra benefits with the finger print, but it did not come to the head, but it was threatened with human safety because the stolen fingerprint hack could make any person get into trouble.",madam setato could also get extra benefits finger print come head threatened human safety stolen fingerprint hack could make person get trouble
pos,The love of the heart remains in the heart and Insha Allah will be there,love heart remains heart insha allah
neg,"Even if you had a Jose Jose goal, it was time to jump the wrong kick.",even jose jose goal time jump wrong kick
neg,"Comedy and VAT Azim will not have to pay a large text bill on a restaurant signboard.A gentleman from Chirkumar saw the offer and entered the restaurant and played it.When he was leaving after eating, the waiter handed the bill to the gentleman.You told the manager how cheating you did not say to pay the bill.The manager said this is the bill.The gentleman of the everlasting gentleman said the word Rabis 1The Hon'ble Finance Minister said that private university authorities will not pay VAT to the educationists.Hopefully, thanks to the Hon'ble Minister of such a decision, no one is short or not short of the money to the institution.Hearing the decision of the finance minister, he thinks that the students will be taken to the students like Rabis Shiva like a gentleman.Government public universities are not enough in proportion to the total population in the countryMany are forced to admit to private universitiesEveryone in the private university student is the child of a good familyAll of these private universities are not financial aspectsMany middle -class family loans cost children's educationIn his decision, the boy's daughter may be studying so that the minister will not hurt the boys and girls are outside the country.Do these business in the name of government educationIt is the opposite to focus on the private university students to reduce the tuition fees to the students.",comedy vat azim pay large text bill restaurant signboarda gentleman chirkumar saw offer entered restaurant played itwhen leaving eating waiter handed bill gentlemanyou told manager cheating say pay billthe manager said billthe gentleman everlasting gentleman said word rabis honble finance minister said private university authorities pay vat educationistshopefully thanks honble minister decision one short short money institutionhearing decision finance minister thinks students taken students like rabis shiva like gentlemangovernment public universities enough proportion total population countrymany forced admit private universitieseveryone private university student child good familyall private universities financial aspectsmany middle class family loans cost childrens educationin decision boys daughter may studying minister hurt boys girls outside countrydo business name government educationit opposite focus private university students reduce tuition fees students
neg,"After the first twenty minutes of sleeping, it is a way to sleep without giving a cheap dialogue and unmanned story.",first twenty minutes sleeping way sleep without giving cheap dialogue unmanned story
neg,India sees the interest of such a country,india sees interest country
ntr,Robi Merger did not participate in the auction more than the wave or the operator.,robi merger participate auction wave operator
pos,If the teeth are seen something when something is seen,teeth seen something something seen
pos,Each line touched the mind,line touched mind
pos,Bangladesh,bangladesh
pos,"Shadow Photo City Terror is seeing you Manna Bhai, you see a different feeling in your life, and in the old past movies you like it.",shadow photo city terror seeing manna bhai see different feeling life old past movies like
pos,Like,like
neg,This is a negative example text.,negative example text
neg,The CO's teenager will host a match with the Bangladesh male national football team but the national team will lose.,cos teenager host match bangladesh male national football team national team lose
pos,I put on the timeline,put timeline
pos,Humans are human.Good luck to brother.Great work 1May Allah Almighty help.,humans humangood luck brothergreat work may allah almighty help
neg,This is a negative example text.,negative example text
neg,An atheist met at the atheist,atheist met atheist
neg,This is a negative example text.,negative example text
neg,This is a negative example text.,negative example text
pos,Mango,mango
pos,I am saying that the only one in Bangladesh is Shakib Khan number one Shakib Khan number one Shakib Khan.,saying one bangladesh shakib khan number one shakib khan number one shakib khan
pos,Restless,restless
neg,Writer Authors Shariar Kabir Ha ha ha ha ha ha ha ha so many wise people so many knowledgeable people would not give the weight of knowledge in the country.,writer authors shariar kabir ha ha ha ha ha ha ha ha many wise people many knowledgeable people would give weight knowledge country
neg,Ulu did not give Azan after the birth of Shahriar Kabir,ulu give azan birth shahriar kabir
ntr,"Hey brother, the lack of player in the way, Naikoy John J Nia will talk about it.",hey brother lack player way naikoy john j nia talk
neg,Pakistan's brutality,pakistans brutality
pos,The New Year's Mars Jatra Yatra is really happy news to find a place on the UN cultural heritage.,new years mars jatra yatra really happy news find place un cultural heritage
ntr,In the afternoon,afternoon
ntr,The notification of the person whose pick uploads uploaded with the block will also show,notification person whose pick uploads uploaded block also show
neg,This is a negative example text.,negative example text
pos,Mashrafe is another name for the love of millions of people in Bangladesh,mashrafe another name love millions people bangladesh
neg,"In your opinion, it is their job, so the work of your speakers is to cry and make money from the money to make money",opinion job work speakers cry make money money make money
neg,How many culprits have you taken up to eight crore SIM biometric,many culprits taken eight crore sim biometric
neg,Ershad and voting MP Mofazzal Hossain Chowdhury Maya MP is eligible,ershad voting mp mofazzal hossain chowdhury maya mp eligible
neg,Everyone thinks that everyone is rather than criticizing the Arab and world leadership,everyone thinks everyone rather criticizing arab world leadership
pos,Was in,
ntr,Due to the political situation or the auspicious picture has flopped.,due political situation auspicious picture flopped
neg,Where did I find,find
neg,This is a negative example text.,negative example text
neg,Money,money
ntr,"Of course, it is not necessary to write Bangla through dawn, but there may be other reasons for breaking the conjunction with Siam Rupali or Solomon Lipi Download to see the browser's content settings font selection.",course necessary write bangla dawn may reasons breaking conjunction siam rupali solomon lipi download see browsers content settings font selection
ntr,Uom Uncle is the guys who now give a little retirement a chance,uom uncle guys give little retirement chance
neg,The fourth team never calls runners -up the fourth is the difference in the prize money,fourth team never calls runners fourth difference prize money
ntr,How much was the price,much price
ntr,"Now the point of view is that the agitation of the agitation is not getting the place, mainly the transparency of the recruitment due to bribery corruption is not deprived of talented recruitment.",point view agitation agitation getting place mainly transparency recruitment due bribery corruption deprived talented recruitment
neg,Malawan's baby can not kill Kekau,malawans baby kill kekau
neg,"The owner's name has not been mentioned anywhere on the verdict of the state vs driver Jamir Hossain's case, even though the owner's name has not been printed in the verdict, but the defects of the accidental vehicle have been guilty of the accident and the crime of the crime is indirectly indirectly.",owners name mentioned anywhere verdict state vs driver jamir hossains case even though owners name printed verdict defects accidental vehicle guilty accident crime crime indirectly indirectly
pos,Then the wife would say I was saying Rumor too,wife would say saying rumor
neg,Out,
neg,To cancel the VAT,cancel vat
neg,Won't go,wont go
neg,This is a negative example text.,negative example text
ntr,Whose talent is low,whose talent low
neg,Phone numbers and Myrai countries are moving forward with the Bay of Bengal.,phone numbers myrai countries moving forward bay bengal
neg,"In the World Cup, the Randians could not win against Taskinsani tactically, and could not win against Bangladesh and could not rise in the second question, which was then bowled out.",world cup randians could win taskinsani tactically could win bangladesh could rise second question bowled
neg,I agreed that the woman is not a seat except the seat.,agreed woman seat except seat
ntr,Informational mistakes are the brands of Orio biscuits type companies or many companies make Orio,informational mistakes brands orio biscuits type companies many companies make orio
pos,Good news is a good decision to nominate candidates as per the demand of the public than the power of the people,good news good decision nominate candidates per demand public power people
neg,India is not the best enemy,india best enemy
neg,I will not listen to you anymore,listen anymore
pos,Haha haha ​​how much talent teachers think,haha haha much talent teachers think
ntr,Eda,eda
pos,Much thanks and gratitude,much thanks gratitude
ntr,The official needed,official needed
neg,This is a negative example text.,negative example text
neg,Tell her not to disrespect mom,tell disrespect mom
pos,"Boss dreams one day I will shake hands with the hands of the field whenever the fielding batting bowling moves, Kolija cape got up and the boss fell again.",boss dreams one day shake hands hands field whenever fielding batting bowling moves kolija cape got boss fell
neg,The eye hurts,eye hurts
neg,"When the last time the drama is not the friend of the Chhatra League, the friend does not fight",last time drama friend chhatra league friend fight
neg,Shahriar's nappy mind is no longer a wise man than a Shala atheist,shahriars nappy mind longer wise man shala atheist
pos,Thanks,thanks
neg,Chinmini,chinmini
pos,"Lyrics, if you are not stolen",lyrics stolen
neg,This is a negative example text.,negative example text
ntr,Remotley or Per Fulltime Office Job Brother,remotley per fulltime office job brother
neg,I gave a friend at first that these musicians know these musicians.,gave friend first musicians know musicians
pos,Still listening to music is one of the favorite songs,still listening music one favorite songs
pos,Favorite,favorite
ntr,You can also do that contact,also contact
neg,This is a negative example text.,negative example text
neg,This is a negative example text.,negative example text
pos,Unhealthy,unhealthy
neg,"So when it was yellow, Ramos became",yellow ramos became
neg,This kind of dialogue like this happened before,kind dialogue like happened
neg,Then,
ntr,"In fact, the main attempt was that people were the main attempt to say that the post of the player in the words of the player in the words of the player, I could not say in the post.",fact main attempt people main attempt say post player words player words player could say post
neg,It is natural for the innocent animals to have innocent animals whose coal poisoning gas is preparing for the anti -Rampal Power Plant movement to have tear gas heated water.,natural innocent animals innocent animals whose coal poisoning gas preparing anti rampal power plant movement tear gas heated water
neg,This is a negative example text.,negative example text
pos,Giggle,giggle
neg,"When listening to them, the baby in the stomach of the month to protest to protest",listening baby stomach month protest protest
pos,Mahatma Gandhi Seji Baxal and autocratic,mahatma gandhi seji baxal autocratic
neg,DiBala Icardi Pastur John Dal,dibala icardi pastur john dal
neg,The grandchildren have a search for the workmen of the work,grandchildren search workmen work
neg,Dennis and Pako ray keep the course,dennis pako ray keep course
neg,Atheist,atheist
pos,Mind wants to see repeatedly,mind wants see repeatedly
pos,"Wow, even though I am an Awami League supporter, I am fascinated by the BNP's peaceful program.",wow even though awami league supporter fascinated bnps peaceful program
neg,It is not interesting to watch the channels of the native channels or the channels of the native channels.,interesting watch channels native channels channels native channels
ntr,It is the reality of the country to hear the cheeks or not safely,reality country hear cheeks safely
pos,Please do not skip him without order,please skip without order
neg,This is the strange strange of Bangladesh brother here today and not the opposite.,strange strange bangladesh brother today opposite
neg,It is time to retire to Rupam and Retalib,time retire rupam retalib
pos,Wow is beautiful,wow beautiful
pos,Found,found
neg,The video is a big one,video big one
ntr,It will go to the trekker or to add during the submit,go trekker add submit
neg,This is a negative example text.,negative example text
ntr,Brother Habiganj where did your office apply for months online have not yet been contacted,brother habiganj office apply months online yet contacted
neg,This is a negative example text.,negative example text
neg,Some of the RAB killed them in the alleged gun battle as per the rules involved in the crime,rab killed alleged gun battle per rules involved crime
ntr,Robi Sim is giving the network speed now that good quality grandchildren will not increase if you increase the network speed.,robi sim giving network speed good quality grandchildren increase increase network speed
neg,Born in a Muslim house like atheist,born muslim house like atheist
pos,So beautiful,beautiful
neg,"The halarasadharan could not drive the atheist without being hurt by the police, saying that the shawl was saying big.",halarasadharan could drive atheist without hurt police saying shawl saying big
ntr,The comment has given everything to everything and I will write now that the articles will be correct by seeing Shahriar poet.,comment given everything everything write articles correct seeing shahriar poet
neg,Allah will judge the Day of Resurrection not tolerate the torture of such beautiful soft children,allah judge day resurrection tolerate torture beautiful soft children
neg,This is a negative example text.,negative example text
neg,Then say the mistake of the corps dimuna is the money,say mistake corps dimuna money
ntr,Many have been forced to keep politics away for fear of attacking the case.,many forced keep politics away fear attacking case
neg,This is a negative example text.,negative example text
pos,Joyful,joyful
pos,"In fact, I am overwhelmed with the thoughts of big quality people",fact overwhelmed thoughts big quality people
neg,This is a negative example text.,negative example text
neg,Messi is playing less in the match,messi playing less match
ntr,Website is illegal,website illegal
ntr,"Run in the match of Kohli for the best player in the world, now Shakib has seen Shakib's run in the format of Shakib.Give Jan Pran Shakib Al Hasan everyone enjoy the game of Shakib",run match kohli best player world shakib seen shakibs run format shakibgive jan pran shakib al hasan everyone enjoy game shakib
pos,Brother today I can express the joy of seeing you in the language of Nasra today,brother today express joy seeing language nasra today
pos,I am proposing to pass it so I will give a jersey to Barcelona.,proposing pass give jersey barcelona
ntr,Nitai da Dada - Mubile writes - Fine Habi Habi Habi Habi Habi Habi - Now Leptop - Partu is not fine - I disagree directly.,nitai da dada mubile writes fine habi habi habi habi habi habi leptop partu fine disagree directly
neg,Porn sites do not teach good,porn sites teach good
pos,Gosh,gosh
neg,"If you do not have to give the above comment Zuckerberg Sahib to comment on the main country of Bangladesh Agricultural Country, then the sinner tries to understand the sinful brother.",give comment zuckerberg sahib comment main country bangladesh agricultural country sinner tries understand sinful brother
ntr,Not,
neg,I see the bus falls in the jam of Vijay Sarani,see bus falls jam vijay sarani
ntr,Watch,watch
neg,This is a negative example text.,negative example text
neg,Dada Dae Business Business - Many people sit on the side of the silk.🚫,dada dae business business many people sit side silk
pos,The goal interval is clear to see,goal interval clear see
neg,Zaid Khan Ray said,zaid khan ray said
pos,Messi is the best of all time even if the World Cup has not won,messi best time even world cup
neg,It is strange to think that Sri Lanka cricket team was a few days ago Bangladesh.,strange think sri lanka cricket team days ago bangladesh
pos,Congratulations to Tumi Mustafiz Tumi suit you all got all over,congratulations tumi mustafiz tumi suit got
neg,This is a negative example text.,negative example text
neg,I will enjoy only a few benefits and disadvantages everyone,enjoy benefits disadvantages everyone
neg,A piece of hungry dog ​​is the revolutionary heart,piece hungry dog revolutionary heart
pos,Apu has been beautiful,apu beautiful
pos,Bangladesh on the list of richest countries in the world,bangladesh list richest countries world
neg,This is a negative example text.,negative example text
ntr,Hum always trying to save the sav,hum always trying save sav
pos,Congratulations Mashrafe in the first light you are the real boss real hero Selut boss,congratulations mashrafe first light real boss real hero selut boss
neg,"Dhawan, who is reluctant to be named, knows how much knowledge sir does not explain a little",dhawan reluctant named knows much knowledge sir explain little
neg,The occupation of minorities is politically powerful and the law listens to the law.,occupation minorities politically powerful law listens law
pos,The man will remember the body when he is dying when he is dying,man remember body dying dying
neg,I got the time I thought I would register the SIMs and I did not swear.,got time thought would register sims swear
neg,"The Rohingya bodies are pouring on the banks of the Naf river, but Myanmar's military personnel are running towards Bangladesh, but the Rohingya border guards are pushing the Bangladesh border guards back to Myanmar.",rohingya bodies pouring banks naf river myanmars military personnel running towards bangladesh rohingya border guards pushing bangladesh border guards back myanmar
neg,The inferior murderers of the world of guerrillas have heard of the guys in the mouth of the sinner of the sinners for so long.,inferior murderers world guerrillas heard guys mouth sinner sinners long
ntr,Sonali thought of childhood,sonali thought childhood
neg,Dad,dad
pos,As well as listening,well listening
pos,The country is now at speed,country speed
ntr,"There is no alternative to good coaches, not just the coach will not work with a Shakib Tamim and Mushfiq, without a good game, where the batting player is not different after the departure of the batting top order and the TAIL is not different, and the bowling is not only limited to the weakness of the vulnerability.",alternative good coaches coach work shakib tamim mushfiq without good game batting player different departure batting top order tail different bowling limited weakness vulnerability
pos,Hit only then the most suitable blogger book to write politics is confirmed,hit suitable blogger book write politics confirmed
neg,"When you see the chicken poet, I know why the day goes bad as the shala in the shala",see chicken poet know day goes bad shala shala
ntr,"I read the post at night very well -known creative analysis is the most good thing that describes each line in such a way that the post does not bother to read the post, adding that the off the ball movement is currently Messi's rival in the Iniesta de Bruyne Ronaldo of the ball.",read post night well known creative analysis good thing describes line way post bother read post adding ball movement currently messis rival iniesta de bruyne ronaldo ball
ntr,Ghazi Bhai how did I like to read the comments less,ghazi bhai like read comments less
pos,Just,
ntr,Well said,well said
neg,The government will escape the country or so VAT,government escape country vat
neg,This is a negative example text.,negative example text
pos,Many thanks brother,many thanks brother
ntr,This is a neutral example text.,neutral example text
neg,Book,book
neg,The guy,guy
pos,Thanks Shoaib can evaluate another speed of one of the best speeds,thanks shoaib evaluate another speed one best speeds
ntr,Curiosity,curiosity
neg,They may have to pay taxes like money a month,may pay taxes like money month
neg,"After the investigation, it will be understood where his real house is and the purpose of saying Gopalganj",investigation understood real house purpose saying gopalganj
neg,"Despite commenting, I died.",despite commenting died
neg,They like to express the lunatic of the crazy circus as a Joker,like express lunatic crazy circus joker
pos,Brother thanks to tell the truth,brother thanks tell truth
neg,Bhacatra's brokers say no,bhacatras brokers say
pos,Grameenphone job opportunities without experience give the opportunity to visit friends,grameenphone job opportunities without experience give opportunity visit friends
pos,The poem is wonderful,poem wonderful
neg,Brother BJP has started mischief in the country that they ended the country.,brother bjp started mischief country ended country
ntr,Ne Beachi's brother,ne beachis brother
pos,Like pretty poetry,like pretty poetry
ntr,This is a neutral example text.,neutral example text
pos,"Where will I retire for ten more years, where can I get relaxed entertainment.",retire ten years get relaxed entertainment
neg,The admin is sitting on the social site to write in the mattress,admin sitting social site write mattress
neg,"Crime will never take help of a foul SIM, maybe know the good means because the world is lacking or the government is not taking people to the most valuable assets of hostage life.",crime never take help foul sim maybe know good means world lacking government taking people valuable assets hostage life
neg,This is a negative example text.,negative example text
ntr,Water is also beneficial in the heat,water also beneficial heat
neg,This is a negative example text.,negative example text
neg,"The first time I installed the new Ubuntu, I gave the first time that the next time I see the connect does not come.",first time installed new ubuntu gave first time next time see connect come
neg,This is a negative example text.,negative example text
pos,Mashrafe saw good people and crying came in happiness,mashrafe saw good people crying came happiness
