label,translated_clean_data,cleaned_text
ntr,Spending a good time is understood that the picnic definition is still giving the picnic formalin fruits at the expanded restaurant.,spending good time understood picnic definition still giving picnic formalin fruits expanded restaurant
pos,Nice to see your picnic in programs that kids have more fun,nice see picnic programs kids fun
pos,Fanatical poem,fanatical poem
neg,Think of the fact that girls need not be blamed,think fact girls need blamed
neg,"Writing the experience of the War of Liberation was a little bit interested in the subject, it was not a long time that the country was independent. The freedom fighters started returning to the cantonment.If you see or do not join the military, I can expect the next post rich in the area around the area and people who experience people in the eyes of a warrior fighter.",writing experience war liberation little bit interested subject long time country independent freedom fighters started returning cantonmentif see join military expect next post rich area around area people experience people eyes warrior fighter
neg,Now the old director dismisses the next time I don't want to see anymore,old director dismisses next time dont want see anymore
neg,The dog's baby in the dog comes to Ekla e,dogs baby dog comes ekla e
neg,Ross is the light of the light circulation ray post,ross light light circulation ray post
neg,Indian Army is trying to kill many birds in one pile,indian army trying kill many birds one pile
neg,This is a negative example text.,negative example text
ntr,That's what brother,thats brother
neg,This is a negative example text.,negative example text
ntr,Not,
neg,It is easy to do the jail as you want to be guilty,easy jail want guilty
neg,"If the old tactnology does not come out of Bangladesh's mobile operators, the people of Bangladesh will never be able to enjoy the highest benefits of information technology.",old tactnology come bangladeshs mobile operators people bangladesh never able enjoy highest benefits information technology
pos,"Post screenshot shops will go to the big barrier to bring a big leaflet, you are not a woman or a good woman.",post screenshot shops go big barrier bring big leaflet woman good woman
neg,Everyone can with Bangladeshi,everyone bangladeshi
ntr,Normal people live to understand the new generation it can't live it,normal people live understand new generation cant live
pos,Fielding Bangladesh is still lagging behind the successful team of Tiger Tiger full teams in the challenge of Mashrafe's experience to win the match under pressure.,fielding bangladesh still lagging behind successful team tiger tiger full teams challenge mashrafes experience win match pressure
pos,"Thank you very much for explaining the truth to us brother, but many brothers will not understand because they do not understand playing.",thank much explaining truth us brother many brothers understand understand playing
neg,Education sector is not the Income Source not understanding this,education sector income source understanding
neg,Love is nothing to say love,love nothing say love
ntr,Not,
pos,Yes Man was the previous time in Yahoo Top Ten,yes man previous time yahoo top ten
ntr,"I do not agree with the writing of thought action, so to eliminate you in the morning to break you in the afternoon, fascism is the name of thought and mind to kill you without existence.",agree writing thought action eliminate morning break afternoon fascism name thought mind kill without existence
ntr,Bangladesh has implemented these India agendas in the Delhi Aid Training Bond Derr to cooperate in Bangladesh.,bangladesh implemented india agendas delhi aid training bond derr cooperate bangladesh
neg,Hasina Sarkar has raised the head of the mother -in -law's children,hasina sarkar raised head mother laws children
pos,Bodd love brother,bodd love brother
pos,Thanks,thanks
ntr,Each team in Serie A plays a solid defensive,team serie plays solid defensive
neg,This is a negative example text.,negative example text
ntr,"If the brother has the money, then he can go abroad, if you do not research the lamp and if you do not.",brother money go abroad research lamp
neg,"Chhatra League Gunda League police are the main power of Awami League's power in the face of Awami League, but it is true that they protect them at the bottom.",chhatra league gunda league police main power awami leagues power face awami league true protect bottom
neg,Fatal player,fatal player
neg,Gaza's speed is eating at the speed of Five G Five G. It is coming to the head,gazas speed eating speed five g five g coming head
ntr,Mashrafe is feeling lacking,mashrafe feeling lacking
neg,No,
neg,"In the newspaper, the crowd of taxes of the crowd made false advertisements for Rampal",newspaper crowd taxes crowd made false advertisements rampal
ntr,"On the other hand, the Linux kernel itself is impossible to operate today without GNU compiler collection and tools, but it is impossible to use it today, but only Linux Linux is the only way to keep the GNU contributing.",hand linux kernel impossible operate today without gnu compiler collection tools impossible use today linux linux way keep gnu contributing
neg,This is a negative example text.,negative example text
ntr,Remember that the blood of Brazil is flowing inside too,remember blood brazil flowing inside
ntr,Old Dhaka Thakeswari Temple,old dhaka thakeswari temple
neg,Spell,spell
pos,So beautiful,beautiful
ntr,Remember to know if you can participate in the festival but the festival of Hindus,remember know participate festival festival hindus
ntr,"Maybe one day, Khaleda Zia is not jailed for the nation to pay the price to the nation because it is done with the purpose of the process because it can pay the nation as a citizen of the country.",maybe one day khaleda zia jailed nation pay price nation done purpose process pay nation citizen country
neg,Secretary,secretary
pos,"Today, the words of the mind are turned around in the mind, brother.",today words mind turned around mind brother
neg,That day was tested in Australia but it would have been successful that was the leaf trap of India,day tested australia would successful leaf trap india
neg,Brother Options Increase the tie of the tie of the tie of Karekaran in Madridakaliza at PS Jiyadha Neymar.,brother options increase tie tie tie karekaran madridakaliza ps jiyadha neymar
neg,Shoe beating your cheek,shoe beating cheek
pos,Look good,look good
pos,Glad Mashrafe got a hero like Mashrafe is trying to change the whole nation by introducing the whole nation to real heroes,glad mashrafe got hero like mashrafe trying change whole nation introducing whole nation real heroes
neg,This is a negative example text.,negative example text
pos,Talk about the son of the Sheikh dynastyIt will be a little different,talk son sheikh dynastyit little different
ntr,Putty,putty
neg,"Extremely hated, these policemen were beaten like a bearded by these policemen.",extremely hated policemen beaten like bearded policemen
neg,Body Builder Con Ladis Zaid Ladies Hall Salman Huff Ladies,body builder con ladis zaid ladies hall salman huff ladies
neg,This is a negative example text.,negative example text
neg,Hi -level I didn't understand that many people say Python is a very simple programming language with the simple difficult to get high level low level relationships.,hi level didnt understand many people say python simple programming language simple difficult get high level low level relationships
neg,"People like chicken Kabir made the Prothom-alo magazine as the intellectual nation's extreme disappointment, but people did not expect better comments to the Birdarpar like a freedom fighter as a freedom fighter today.",people like chicken kabir made prothomalo magazine intellectual nations extreme disappointment people expect better comments birdarpar like freedom fighter freedom fighter today
neg,Beast,beast
neg,Not crazy,crazy
neg,This is a negative example text.,negative example text
neg,Nobble,nobble
neg,"The birth of the country till today is the procession of the students to accept the blood of the student.Sweat -to -be money money is not the money to be comforted in the AC minister's AC room, but the VAT Dimu government will study for free examples.",birth country till today procession students accept blood studentsweat money money money comforted ac ministers ac room vat dimu government study free examples
pos,Love brother,love brother
neg,Shawl,shawl
neg,This is a negative example text.,negative example text
neg,This is a negative example text.,negative example text
neg,He said the girl did not agree to the marriage and said that the marriage was about to go to the police and did not get married.,said girl agree marriage said marriage go police get married
pos,A cricketer who is proud as a Bangladeshi has earned the rare honor of the country.,cricketer proud bangladeshi earned rare honor country
neg,"If you travel to St. Martin, do not get to the resort of the thief, the thief's chat is Aida",travel st martin get resort thief thiefs chat aida
neg,This is a negative example text.,negative example text
neg,The BNP has identified tolerance that the non -inflamed political society has not been confused and the case cannot be accepted.,bnp identified tolerance non inflamed political society confused case accepted
pos,There will be problems with the big Problem big problem that is solved by resolving it will be able to go through the bridge soon.,problems big problem big problem solved resolving able go bridge soon
ntr,Sirius,sirius
pos,Brother loved a lot,brother loved lot
pos,Cannot understand the commentator and goal,understand commentator goal
neg,This is a negative example text.,negative example text
neg,So I do not know when to get Ji or G like Ji Sebai Pi Nah.,know get ji g like ji sebai pi nah
ntr,The firmware file does not mean the firmware in the model and give it the copy of the modem and see if you get the interface.,firmware file mean firmware model give copy modem see get interface
neg,That is why the autocratic road will be cleansed,autocratic road cleansed
neg,"At the time, the SIM card mobile phone is not crime or the crime is still being equal in the same rhythm.",time sim card mobile phone crime crime still equal rhythm
ntr,With the story of the picture,story picture
pos,"I hope that as a wonderful episode of the time, InshaAllah has come up with details",hope wonderful episode time inshaallah come details
pos,Proceed to the plural,proceed plural
pos,The best teams in the Champion League seem to be playing,best teams champion league seem playing
neg,"The country is running in the landmark style, which is not a roadmap, wandering with the wind like a cloud to keep the nation's new life roadmap in the kind of day.",country running landmark style roadmap wandering wind like cloud keep nations new life roadmap kind day
pos,Due to this profit because of the profit,due profit profit
neg,"The way the brother said to give up the hope of winning the match of Gomez, the rest of the people would sit and suck his finger.",way brother said give hope winning match gomez rest people would sit suck finger
neg,"If the arrogance is a little reduced, many more fan will increase your",arrogance little reduced many fan increase
pos,Nice to get beautiful comments like the heart will be thank you,nice get beautiful comments like heart thank
ntr,With money,money
neg,Hypocritical poet,hypocritical poet
neg,The SIM is not forgery or the corresponding mobile phone operator's customer service center will be the cost to change the SIM with the value added tax to change the SIM.,sim forgery corresponding mobile phone operators customer service center cost change sim value added tax change sim
neg,This is a negative example text.,negative example text
pos,"The corrupt fisherman is free and corrupt in the corrupt fishermen, but the corrupt people are in jail for the jail, but regret.",corrupt fisherman free corrupt corrupt fishermen corrupt people jail jail regret
neg,No that is worse,worse
neg,"The party does not have the bandar of the party, this year's visit to Bangladesh, Bangladesh Pitch making started from the very beginning of the player's election field, whose result is the result of the result.",party bandar party years visit bangladesh bangladesh pitch making started beginning players election field whose result result result
pos,It was nice to see,nice see
neg,The father of the country will say that the mother of the country will ask for the father and will not be fulfilled at Gopalganj.,father country say mother country ask father fulfilled gopalganj
neg,This is a negative example text.,negative example text
pos,Haha haha ​​great,haha haha great
neg,"The man named the chicken poet thinks that the enemy of Islam is not the enemy of Islam, but you are also scandalized by the atheist Paris, you have given you the right to include all of your party in the atheist group, and the Awami League principles will be established by the entire party.Allah will read you the guidance of you to die",man named chicken poet thinks enemy islam enemy islam also scandalized atheist paris given right include party atheist group awami league principles established entire partyallah read guidance die
neg,"Meanwhile, thousands of people are spending half -day in the tin rice, the media does not notice",meanwhile thousands people spending half day tin rice media notice
neg,This is a negative example text.,negative example text
ntr,Jirona,jirona
ntr,In order,order
neg,"They do not come to the Muslim Muslim dies, but the non -Muslim mother -in -law used to abuse the world, but now the Muslims are not sitting on their backs to protest the humanitarian organization.",come muslim muslim dies non muslim mother law used abuse world muslims sitting backs protest humanitarian organization
neg,The best jargabalish Shahriar Shahriar khek fox is the only one who saw the appearance of the devil's faith in the devil.,best jargabalish shahriar shahriar khek fox one saw appearance devils faith devil
pos,Shankhari Bazar Bazar area and yes everyone can attend,shankhari bazar bazar area yes everyone attend
pos,Love brother,love brother
pos,Nice to love the pictures of your joyful moments of Baby,nice love pictures joyful moments baby
neg,When the Chattibizers debut as a writer,chattibizers debut writer
neg,"If Valvarde Sir is in the group, please come forward",valvarde sir group please come forward
pos,"Every time Suni is in the song, I am watching the shepherd",every time suni song watching shepherd
neg,"Want to condemn against anyone professional, but I have given you the responsibility of the amateur Sujan to deal with professional ways whose hair is found to play the result of playing.",want condemn anyone professional given responsibility amateur sujan deal professional ways whose hair found play result playing
neg,Grameenphone company,grameenphone company
ntr,There is nothing to say,nothing say
neg,"The declaration of independence has not heard that the war has been arrested, everyone knows that the war was going on. Everyone knew that the announcer was busy.",declaration independence heard war arrested everyone knows war going everyone knew announcer busy
neg,This is a negative example text.,negative example text
pos,Good work,good work
pos,"Hero, despite the hundreds of obstacles, is on their way to their own way, there are many shadow walls to break the shadow walls of the real heroes are not the heroes of the movie drama.Salute to real -life heroes",hero despite hundreds obstacles way way many shadow walls break shadow walls real heroes heroes movie dramasalute real life heroes
neg,Stolen,stolen
neg,The thief takes a thief when he looks at the face,thief takes thief looks face
neg,What kind of gomez love did not understand,kind gomez love understand
ntr,South Africa took India lightly,south africa took india lightly
pos,Brother has dropped a few times and then it looks good to read,brother dropped times looks good read
pos,Thanks dear friend,thanks dear friend
neg,"Where did you get the brother, brother",get brother brother
pos,Great news,great news
pos,Where Pulpan Fab says brother link hoppe can understand the link.,pulpan fab says brother link hoppe understand link
neg,Exclude Fizmali,exclude fizmali
neg,"Yet the government of Bangladesh is going to lick the uneven cheeks of the Government of India, and the cheek should be slapped.",yet government bangladesh going lick uneven cheeks government india cheek slapped
neg,The hell of the hell ignored the bolt of many large sizes,hell hell ignored bolt many large sizes
pos,"Some of the crazy crazy pizzies are thinking of buying a team of money, everyone says madness madness love.",crazy crazy pizzies thinking buying team money everyone says madness madness love
ntr,I heard a lot of siblings I was writing briefly,heard lot siblings writing briefly
ntr,Valvarde Kakui knows best,valvarde kakui knows best
pos,"No one can say except the setato coach, but it would be better to go down the card and find the ball when you get the ball.",one say except setato coach would better go card find ball get ball
pos,Laughing,laughing
neg,Scolding,scolding
neg,Camon,camon
neg,Thieves,thieves
neg,Thief,thief
neg,I heard that during the War of Independence the Pak army would supply chicken supplies to be appropriate punishment,heard war independence pak army would supply chicken supplies appropriate punishment
ntr,I thought I was downloading with AMD Lapi to see Auto Download AMD version,thought downloading amd lapi see auto download amd version
ntr,Retirement is not seeking safe exit,retirement seeking safe exit
ntr,"The debt is a sign of the husband's love for the wife, which the husbands give in accordance with the financial capacity.It is financial lane - not a matter of donation, love and respectStupid",debt sign husbands love wife husbands give accordance financial capacityit financial lane matter donation love respectstupid
ntr,Morakaba caught when the eyes were understood or not,morakaba caught eyes understood
pos,These are ours,
pos,The golden days are less than the brother's ghost,golden days less brothers ghost
neg,This is a negative example text.,negative example text
pos,The news is very good,news good
neg,"Guru Ganja Banila, I see everyone talking about Abol Tabol",guru ganja banila see everyone talking abol tabol
neg,Wash,wash
pos,Jani is wrong but the water in the corner of the eye has come well,jani wrong water corner eye come well
ntr,Faizlami,faizlami
pos,Two days were very good for the welfare of the man next to him,two days good welfare man next
pos,Those who do not need 100 percent believed tests do not require,need percent believed tests require
neg,This is a negative example text.,negative example text
pos,Love you,love
neg,This is a negative example text.,negative example text
pos,Like,like
neg,Myr,myr
neg,"People who dislike guilty people will not be easily trapped to say that the criminal will not be able to catch the criminals, but the crime is not found in the crime criminal class, but this is the reality of keeping the guilty in the safe song of the light of the light of the light of light.",people dislike guilty people easily trapped say criminal able catch criminals crime found crime criminal class reality keeping guilty safe song light light light light
ntr,One of the favorites,one favorites
pos,Want to hear the song repeatedly,want hear song repeatedly
pos,Nice unarmed no longer congrats you,nice unarmed longer congrats
neg,The title is a sudden 'allergy' in Bangladesh cricket,title sudden allergy bangladesh cricket
neg,Everyone likes to disqualify Khaleda Zia in the same way,everyone likes disqualify khaleda zia way
neg,"If I do not like the military, then Ershad's tenure is a good time in Bangladesh during the rest of the robbery.",like military ershads tenure good time bangladesh rest robbery
neg,"As well as research in foreign doctors, doctors familiar with new technologies as a result of research",well research foreign doctors doctors familiar new technologies result research
ntr,This is a neutral example text.,neutral example text
neg,"In the country, there is a lack of intellectuals in the country to be so intellectuals that the first al -Ala's interview is not known to the Islamic Islamic scholarship, and that any religious warrior of Muslims love to propagate the fundamentalism as a communalism.The greater population will consider the religious world",country lack intellectuals country intellectuals first al alas interview known islamic islamic scholarship religious warrior muslims love propagate fundamentalism communalismthe greater population consider religious world
neg,Arrest,arrest
neg,"Well, I do not think the service direction is in place.",well think service direction place
ntr,"If the SIM does not require sincere and if the police are independent, then the crime will be reduced to the crime.",sim require sincere police independent crime reduced crime
pos,Thanks Bhai and he is a public believer in that kind of public,thanks bhai public believer kind public
neg,The enemy is to excavate these stalk,enemy excavate stalk
neg,The doctors could not treat a headache on the horse's egg,doctors could treat headache horses egg
neg,This is a negative example text.,negative example text
pos,Rag,rag
pos,Looked good,looked good
pos,"The appearance is good, so everyone in the game is playing such games, the players are more handsome.",appearance good everyone game playing games players handsome
ntr,Welcome the new attempt with all the feelings of the mind,welcome new attempt feelings mind
neg,The administration was able to find the backyard,administration able find backyard
ntr,"Okay, Anu's brother will give",okay anus brother give
pos,Extraordinary,extraordinary
ntr,The Required Edit has been done in accordance with the request of the amendment,required edit done accordance request amendment
neg,Bangladeshi media Prithvi's most terrible media topic is found in Pregnant Kaira after the release of Priya after the release of Priya.,bangladeshi media prithvis terrible media topic found pregnant kaira release priya release priya
neg,"Seven people, including six foreign nationals were arrested on suspicion of alleged conspiracy, were detained on February four of those detained in Yemen.",seven people including six foreign nationals arrested suspicion alleged conspiracy detained february four detained yemen
neg,"Randia, the main enemy of Bengal",randia main enemy bengal
ntr,Ham,ham
pos,Nice to the song,nice song
neg,This is a negative example text.,negative example text
neg,This is a negative example text.,negative example text
neg,He is like a human being and the happiness of the animal is how to be the name of the father himself.,like human happiness animal name father
neg,"The cockroach is also the author of Shahriar Kabir, the author of the bird",cockroach also author shahriar kabir author bird
pos,Thanks to the beautiful story Abuhaena Md. Ashraful Islam,thanks beautiful story abuhaena md ashraful islam
pos,Laughter Dilir Father Pictures are pretty nice,laughter dilir father pictures pretty nice
ntr,Tamim Sarkar Mushi has no urge to be spit,tamim sarkar mushi urge spit
pos,Beautiful,beautiful
pos,O O O O,
neg,Each batsman felt that no one had ever batted,batsman felt one ever batted
ntr,"If the power of the power party was the head of the political party, I would have given the quota issue to the people of the country, if the people of the country would not want, then the quota of the total votes in favor of the cancellation of the vote did not want to vote and joined the constitution again if the political party wanted to launch quota again, but again to launch the quota.",power power party head political party would given quota issue people country people country would want quota total votes favor cancellation vote want vote joined constitution political party wanted launch quota launch quota
pos,Brother loves so much,brother loves much
neg,The only reason you launch biometric is that these countries will no longer chaos to make anti -government voices.,reason launch biometric countries longer chaos make anti government voices
neg,Aph,aph
pos,Be happy for a lifetime of bonding,happy lifetime bonding
neg,"The girl does not see much in the hands of the girl, the criminal is not so stupid or crime with the sim",girl see much hands girl criminal stupid crime sim
neg,Teletalk iPhone customers will be able to use the reporter from the beginning.,teletalk iphone customers able use reporter beginning
neg,Drunk is a day of addiction,drunk day addiction
ntr,"If you do not know directly, you do not have the opportunity to answer the wrong answer to the best overconfident",know directly opportunity answer wrong answer best overconfident
pos,"Alhamdulillah is proud of as a Bengali, the son of the golden son of the ICC, the emerging cricketer of the Year of the year, cannot explain to brother.",alhamdulillah proud bengali son golden son icc emerging cricketer year year explain brother
ntr,Brother will be able to play Greezman tomorrow,brother able play greezman tomorrow
pos,The pictures are good,pictures good
ntr,Depending where you live,depending live
neg,The most corruption in the banking sector of Bangladesh,corruption banking sector bangladesh
pos,Today I saw on Channel I like,today saw channel like
neg,Tomorrow is the leader of the leader to buy the question that is new. Its simple nothing new,tomorrow leader leader buy question new simple nothing new
neg,Another shawl is the news,another shawl news
